{
  "$schema": "https://json-schema.org/draft/2020-12/schema",
  "$id": "https://mandarin.canon/schemas/grondslagen.schema.json",
  "title": "Mandarin Grondslagen Registry (Genormaliseerd)",
  "description": "Schema voor de registratie van grondslagen binnen het Mandarin-ecosysteem, met genormaliseerde value stream en fase structuur. Dit register is een selectie-index voor canonieke grondslagen en is nadrukkelijk geen runlog voor execution-bestanden of execution-trace-bestanden.",
  "type": "object",
  "properties": {
    "$schema": {
      "type": "string",
      "description": "Verwijzing naar dit schema"
    },
    "versie": {
      "type": "string",
      "description": "Versie van deze grondslagen-registratie",
      "pattern": "^\\d+\\.\\d+\\.\\d+$"
    },
    "gegenereerd": {
      "type": "string",
      "format": "date-time",
      "description": "Timestamp van generatie"
    },
    "algemeen": {
      "type": "array",
      "description": "Grondslagen die ecosysteem-breed gelden (niet value-stream-specifiek) en als selectie-index beschikbaar zijn",
      "items": {
        "$ref": "#/$defs/grondslag"
      }
    },
    "value_streams": {
      "type": "object",
      "description": "Value streams met hun grondslagen en fasen, bedoeld voor selectie van toepasselijke canonieke bronnen",
      "additionalProperties": {
        "$ref": "#/$defs/value_stream"
      }
    }
  },
  "required": ["versie", "algemeen", "value_streams"],
  "$defs": {
    "grondslag": {
      "type": "object",
      "description": "Een individuele grondslag (doctrine, constitutie, concepten, etc.) als indexeerbare canonieke bron",
      "properties": {
        "naam": {
          "type": "string",
          "description": "Bestandsnaam van de grondslag (zonder pad)",
          "pattern": "^[a-z0-9-]+\\.md$"
        },
        "pad": {
          "type": "string",
          "description": "Relatief pad vanaf grondslagen/ folder"
        },
        "type": {
          "type": "string",
          "description": "Type grondslag",
          "enum": ["constitutie", "doctrine", "concepten", "kaderdefinitie", "checklist", "value-stream", "grondslag"]
        },
        "digest_header": {
          "type": "string",
          "description": "Digest zoals opgeslagen in de YAML frontmatter van het bronbestand",
          "pattern": "^[0-9a-f]{4}$"
        },
        "digest_berekend": {
          "type": "string",
          "description": "Werkelijke MD5 digest van de body op het moment van export",
          "pattern": "^[0-9a-f]{4}$"
        },
        "status_header": {
          "type": "string",
          "description": "Status zoals opgeslagen in de YAML frontmatter van het bronbestand (hoeft niet overeen te komen met de werkelijke artefacttoestand)",
          "enum": ["vers", "muf", "rot"]
        },
        "versie_header": {
          "type": "string",
          "description": "Versie zoals opgeslagen in de YAML frontmatter van het bronbestand; ondersteunt selectie en latere opnamebeslissingen"
        }
      },
      "required": ["naam", "pad", "digest_header", "digest_berekend", "status_header"]
    },
    "value_stream": {
      "type": "object",
      "description": "Een value stream met eigen grondslagen en fasen",
      "properties": {
        "code": {
          "type": "string",
          "description": "Drie-letterige code van de value stream",
          "pattern": "^[A-Z]{3}$"
        },
        "naam": {
          "type": "string",
          "description": "Volledige naam van de value stream"
        },
        "grondslagen": {
          "type": "array",
          "description": "Grondslagen die gelden voor de gehele value stream",
          "items": {
            "$ref": "#/$defs/grondslag"
          }
        },
        "fasen": {
          "type": "object",
          "description": "Fasen binnen deze value stream, geïndexeerd op fasecode (01, 02, ...)",
          "additionalProperties": {
            "$ref": "#/$defs/fase"
          }
        }
      },
      "required": ["code", "grondslagen", "fasen"]
    },
    "fase": {
      "type": "object",
      "description": "Een fase binnen een value stream",
      "properties": {
        "code": {
          "type": "string",
          "description": "Fasecode (01, 02, ...)",
          "pattern": "^\\d{2}$"
        },
        "naam": {
          "type": "string",
          "description": "Naam van de fase"
        },
        "grondslagen": {
          "type": "array",
          "description": "Grondslagen specifiek voor deze fase",
          "items": {
            "$ref": "#/$defs/grondslag"
          }
        }
      },
      "required": ["code", "grondslagen"]
    }
  }
}
